### ISSUE TITLE
Allow *_PROXY env variables to pass filter to server

### ISSUE THREAD

**Issue by 6elkir** [felddy/foundryvtt-docker#1414]
### Feature description

You need to be able to send container traffic through an http proxy. Not only during initialization, but in general, the whole and always. Unfortunately, not all countries have Foundry servers directly available, which makes it impossible to update modules and systems.

### Motivation

Unfortunately, not all countries have Foundry servers directly available, which makes it impossible to update modules and systems.

### Example

In docker config

### Pitch

Unfortunately, not all countries have Foundry servers directly available, which makes it impossible to update modules and systems.

### Code of Conduct

- [x] I agree to follow this project's Code of Conduct

**Comment by NotHardEngineer** [comment]
I support it! Readme even says that any *_proxy environment arguments should be passed along, but when running an update (or doing anything, really) container aren't even trying to use specified proxy. Only passable solution i have found as of right now is deploy vpn on all host system traffic, update/install all you need in foundry and then go deal with broken dynamic dns.

**Comment by meesvw** [comment]
@6elkir @NotHardEngineer Docker already has a built in option for this https://docs.docker.com/engine/cli/proxy/ only thing you have to do is as follows (when using docker compose):
```yml
services:
  foundry:
    image: felddy/foundryvtt:14
    hostname: foundryvtt
    restart: unless-stopped
    environment:
      - HTTPS_PROXY= # URL OR IP
      - HTTP_PROXY = # URL OR IP
```

Here we can forward the connections setup from within the container to a proxy, which can be hosted elsewhere allowing you to connect from a different location. For example you have a container with a forward proxy connected to a VPN it will work. Or you can always put the whole server/vps through a VPN.

**Comment by NotHardEngineer** [comment]
I've done it:
```
foundry:
    container_name: foundry
    image: felddy/foundryvtt:13
    hostname: <myhostname>
    volumes:
      - type: bind
        source: ./foundrydata/
        target: /data
    environment:
      - HTTPS_PROXY= xray-proxy:1081
      - HTTP_PROXY= xray-proxy:1081
      - CONTAINER_PRESERVE_CONFIG= "true"
      - FOUNDRY_HOSTNAME= "nat21.ru"
      - FOUNDRY_IP_DISCOVERY= "false"
      - FOUNDRY_LOCAL_HOSTNAME= <myhostname>
      - FOUNDRY_MINIFY_STATIC_FILES= "true"
      - FOUNDRY_PROXY_PORT= 80
    ports:
      - 30000
    secrets:
      - source: foundry_config_json
        target: config.json
```
Also i tried to write proxy as

```
      - HTTPS_PROXY= http://xray-proxy:1081
      - HTTP_PROXY= http://xray-proxy:1081
```
and as ip in docker network with port
I am sure my foundry and xray containers are in the same docker network. I also have a jellyfin container using same proxy with no problem. But when i trying to update modules and systems foundryvtt cannot contact its homeserver and TCPdump shows that container arent even trying to contact proxy during update:
IP 172.18.0.10 is my nginx container,
IP 172.18.0.3 is my foundry container,
IP 172.18.0.5 is my xray container.
```
20:35:41.060742 IP 172.18.0.10.60118 > 172.18.0.3.30000: Flags [P.], seq 1:760, ack 1, win 502, options [nop,nop,TS val 1993104911 ecr 2879341266], length 759
20:35:41.060757 IP 172.18.0.3.30000 > 172.18.0.10.60118: Flags [.], ack 760, win 504, options [nop,nop,TS val 2879341266 ecr 1993104911], length 0
20:35:41.066374 IP 172.18.0.3.45386 > cdn-185-199-110-133.github.com.https: Flags [S], seq 3382635248, win 64240, options [mss 1460,sackOK,TS val 1740205070 ecr 0,nop,wscale 7], length 0
20:35:41.146275 IP cdn-185-199-110-133.github.com.https > 172.18.0.3.45386: Flags [S.], seq 2565697522, ack 3382635249, win 65535, options [mss 1432,sackOK,TS val 2163364219 ecr 1740205070,nop,wscale 9], length 0
20:35:41.146323 IP 172.18.0.3.45386 > cdn-185-199-110-133.github.com.https: Flags [.], ack 1, win 502, options [nop,nop,TS val 1740205149 ecr 2163364219], length 0
20:35:41.147108 IP 172.18.0.3.45386 > cdn-185-199-110-133.github.com.https: Flags [P.], seq 1:1841, ack 1, win 502, options [nop,nop,TS val 1740205150 ecr 2163364219], length 1840
20:35:41.226050 IP cdn-185-199-110-133.github.com.https > 172.18.0.3.45386: Flags [.], ack 1841, win 274, options [nop,nop,TS val 2163364300 ecr 1740205150], length 0
20:35:41.226766 IP cdn-185-199-110-133.github.com.https > 172.18.0.3.45386: Flags [P.], seq 1:1548, ack 1841, win 274, options [nop,nop,TS val 2163364300 ecr 1740205150], length 1547
20:35:41.226806 IP 172.18.0.3.45386 > cdn-185-199-110-133.github.com.https: Flags [.], ack 1548, win 490, options [nop,nop,TS val 1740205230 ecr 2163364300], length 0
20:35:41.228351 IP 172.18.0.3.45386 > cdn-185-199-110-133.github.com.https: Flags [P.], seq 1841:2146, ack 1548, win 492, options [nop,nop,TS val 1740205232 ecr 2163364300], length 305
20:35:41.308081 IP cdn-185-199-110-133.github.com.https > 172.18.0.3.45386: Flags [.], ack 2146, win 274, options [nop,nop,TS val 2163364382 ecr 1740205232], length 0
20:35:41.309812 IP cdn-185-199-110-133.github.com.https > 172.18.0.3.45386: Flags [P.], seq 1548:2493, ack 2146, win 274, options [nop,nop,TS val 2163364384 ecr 1740205232], length 945
20:35:41.310035 IP cdn-185-199-110-133.github.com.https > 172.18.0.3.45386: Flags [P.], seq 2493:4802, ack 2146, win 274, options [nop,nop,TS val 2163364384 ecr 1740205232], length 2309
20:35:41.311848 IP 172.18.0.3.45386 > cdn-185-199-110-133.github.com.https: Flags [.], ack 4802, win 492, options [nop,nop,TS val 1740205315 ecr 2163364384], length 0
20:35:41.519182 IP 172.18.0.10.60128 > 172.18.0.3.30000: Flags [S], seq 3736998703, win 64240, options [mss 1460,sackOK,TS val 1993105369 ecr 0,nop,wscale 7], length 0
20:35:41.519217 IP 172.18.0.3.30000 > 172.18.0.10.60128: Flags [S.], seq 746282572, ack 3736998704, win 65160, options [mss 1460,sackOK,TS val 2879341724 ecr 1993105369,nop,wscale 7], length 0
20:35:41.519245 IP 172.18.0.10.60128 > 172.18.0.3.30000: Flags [.], ack 1, win 502, options [nop,nop,TS val 1993105369 ecr 2879341724], length 0
20:35:41.519311 IP 172.18.0.10.60128 > 172.18.0.3.30000: Flags [P.], seq 1:540, ack 1, win 502, options [nop,nop,TS val 1993105369 ecr 2879341724], length 539
20:35:41.519339 IP 172.18.0.3.30000 > 172.18.0.10.60128: Flags [.], ack 540, win 505, options [nop,nop,TS val 2879341725 ecr 1993105369], length 0
20:35:41.521364 IP 172.18.0.3.30000 > 172.18.0.10.60128: Flags [P.], seq 1:309, ack 540, win 505, options [nop,nop,TS val 2879341727 ecr 1993105369], length 308
20:35:41.521392 IP 172.18.0.10.60128 > 172.18.0.3.30000: Flags [.], ack 309, win 501, options [nop,nop,TS val 1993105372 ecr 2879341727], length 0
20:35:41.521513 IP 172.18.0.10.60128 > 172.18.0.3.30000: Flags [F.], seq 540, ack 309, win 501, options [nop,nop,TS val 1993105372 ecr 2879341727], length 0
20:35:41.521715 IP 172.18.0.3.30000 > 172.18.0.10.60128: Flags [F.], seq 309, ack 541, win 505, options [nop,nop,TS val 2879341727 ecr 1993105372], length 0
20:35:41.521744 IP 172.18.0.10.60128 > 172.18.0.3.30000: Flags [.], ack 310, win 501, options [nop,nop,TS val 1993105372 ecr 2879341727], length 0
20:35:45.312657 IP 172.18.0.3.45386 > cdn-185-199-110-133.github.com.https: Flags [F.], seq 2146, ack 4802, win 492, options [nop,nop,TS val 1740209316 ecr 2163364384], length 0
20:35:45.393875 IP cdn-185-199-110-133.github.com.https > 172.18.0.3.45386: Flags [.], ack 2147, win 274, options [nop,nop,TS val 2163368468 ecr 1740209316], length 0
20:35:45.393887 IP cdn-185-199-110-133.github.com.https > 172.18.0.3.45386: Flags [P.], seq 4802:4826, ack 2147, win 274, options [nop,nop,TS val 2163368468 ecr 1740209316], length 24
20:35:45.393893 IP cdn-185-199-110-133.github.com.https > 172.18.0.3.45386: Flags [F.], seq 4826, ack 2147, win 274, options [nop,nop,TS val 2163368468 ecr 1740209316], length 0
20:35:45.393948 IP 172.18.0.3.45386 > cdn-185-199-110-133.github.com.https: Flags [R], seq 3382637395, win 0, length 0
20:35:45.393960 IP 172.18.0.3.45386 > cdn-185-199-110-133.github.com.https: Flags [R], seq 3382637395, win 0, length 0
20:35:45.863299 IP 172.18.0.10.37754 > 172.18.0.3.30000: Flags [S], seq 3670736122, win 64240, options [mss 1460,sackOK,TS val 1993109713 ecr 0,nop,wscale 7], length 0
20:35:45.863344 IP 172.18.0.3.30000 > 172.18.0.10.37754: Flags [S.], seq 680299418, ack 3670736123, win 65160, options [mss 1460,sackOK,TS val 2879346069 ecr 1993109713,nop,wscale 7], length 0
20:35:45.863377 IP 172.18.0.10.37754 > 172.18.0.3.30000: Flags [.], ack 1, win 502, options [nop,nop,TS val 1993109714 ecr 2879346069], length 0
20:35:45.863445 IP 172.18.0.10.37754 > 172.18.0.3.30000: Flags [P.], seq 1:540, ack 1, win 502, options [nop,nop,TS val 1993109714 ecr 2879346069], length 539
20:35:45.863462 IP 172.18.0.3.30000 > 172.18.0.10.37754: Flags [.], ack 540, win 505, options [nop,nop,TS val 2879346069 ecr 1993109714], length 0
20:35:45.865307 IP 172.18.0.3.30000 > 172.18.0.10.37754: Flags [P.], seq 1:309, ack 540, win 505, options [nop,nop,TS val 2879346070 ecr 1993109714], length 308
```

I am really at loss why its doesn't works although it seems like i have done everything right :(
EDIT: formatting

**Comment by Crescentm** [comment]
@6elkir @NotHardEngineer

## Possible root cause

This issue may be related to `ENV_VAR_PASSLIST_REGEX` in `launcher.sh`.

Currently, when the container starts Foundry, it does not directly inherit the full container environment. In `launcher.sh`, `env -i` is used to clear the environment variables, and only variables matching `ENV_VAR_PASSLIST_REGEX` are preserved.

The current passlist is similar to:

```bash
ENV_VAR_PASSLIST_REGEX='^HOME$ ^NODE_.+$ ^TZ$'
```

This means `NODE_USE_ENV_PROXY=1` can be passed to the Foundry Node process, but proxy address variables such as `HTTP_PROXY` and `HTTPS_PROXY` may be filtered out.

As a result, `NODE_USE_ENV_PROXY=1` is present, but Node.js still does not know which proxy to use.

## Temporary workaround

A temporary workaround is to patch `launcher.sh` and add the common proxy-related environment variables to the passlist.

First, copy `launcher.sh` out of the container:

```bash
docker cp <container_id>:/home/node/launcher.sh ./launcher.sh
```

Then change the passlist from:

```bash
ENV_VAR_PASSLIST_REGEX='^HOME$ ^NODE_.+$ ^TZ$'
```

to:

```bash
ENV_VAR_PASSLIST_REGEX='^HOME$ ^NODE_.+$ ^TZ$ ^HTTP_PROXY$ ^HTTPS_PROXY$ ^http_proxy$ ^https_proxy$ ^ALL_PROXY$ ^all_proxy$ ^NO_PROXY$ ^no_proxy$'
```

This can be done with:

```bash
sed -i \
  "s|^ENV_VAR_PASSLIST_REGEX=.*|ENV_VAR_PASSLIST_REGEX='^HOME$ ^NODE_.+$ ^TZ$ ^HTTP_PROXY$ ^HTTPS_PROXY$ ^http_proxy$ ^https_proxy$ ^ALL_PROXY$ ^all_proxy$ ^NO_PROXY$ ^no_proxy$'|" \
  ./launcher.sh
```

After modifying `launcher.sh`, mount it back into the container:

```yaml
volumes:
  - ./data:/data
  - ./launcher.sh:/home/node/launcher.sh:ro
```

Also set the proxy-related environment variables:

```yaml
environment:
  NODE_USE_ENV_PROXY: "1"
  HTTP_PROXY: "http://proxy.example:7890"
  HTTPS_PROXY: "http://proxy.example:7890"
  http_proxy: "http://proxy.example:7890"
  https_proxy: "http://proxy.example:7890"
  NO_PROXY: "localhost,127.0.0.1,::1"
  no_proxy: "localhost,127.0.0.1,::1"
```

Then recreate the container:

```bash
docker compose down
docker compose up -d
```

## Result

After applying this workaround, FoundryVTT was able to download packages successfully through the proxy.

## Suggestion

The core issue seems to be that `NODE_USE_ENV_PROXY=1` is passed to Node.js, but the actual proxy address variables such as `HTTP_PROXY` / `HTTPS_PROXY` are filtered out by the passlist in `launcher.sh`.

It may be worth considering one of the following:

- Add common proxy variables to the default `ENV_VAR_PASSLIST_REGEX`
- Provide a configuration option for additional environment variables to pass through to the Foundry Node process
- Document that `NODE_USE_ENV_PROXY=1` alone is not sufficient unless `HTTP_PROXY` / `HTTPS_PROXY` are also preserved

**Comment by Argon42** [comment]
I can confirm this issue on:

* FoundryVTT 14.363
* Node.js 24.16.0
* ghcr.io/felddy/foundryvtt:14

The root cause appears to be exactly what @Crescentm described.

Inside the container:

```bash
docker exec -it foundryvtt sh -c 'tr "\0" "\n" < /proc/1/environ | grep -iE "proxy|NODE"'
```

shows:

```text
HTTP_PROXY=...
HTTPS_PROXY=...
NODE_OPTIONS=--use-env-proxy
NODE_USE_ENV_PROXY=1
```

However, the actual FoundryVTT Node process:

```bash
docker exec -it foundryvtt sh -c 'tr "\0" "\n" < /proc/<pid>/environ | grep -iE "proxy|NODE"'
```

only contains:

```text
NODE_OPTIONS=--use-env-proxy
NODE_USE_ENV_PROXY=1
```

while `HTTP_PROXY` / `HTTPS_PROXY` are missing.

As a result:

* `docker exec node fetch(...)` works correctly through proxy
* FoundryVTT package repository fails with:

  * `Could not get Repository Packages - TypeError: terminated`
  * `/setup timed out after 30s`

I was able to fully fix the issue by preserving proxy-related variables for the actual Foundry Node process.

After doing that:

* package repository loads correctly
* module/system installation works
* updates work through proxy

Proxy used in my case:

* sing-box mixed HTTP proxy
* HTTP_PROXY=http://192.168.50.2:7890/

**Comment by felddy** [comment]
@Crescentm, Thanks for looking into this.  You are correct the `ENV_VAR_PASSLIST_REGEX` needs to allow all the possible variables specified by: 
- https://www.npmjs.com/package/proxy-from-env#environment-variables
- https://www.npmjs.com/package/proxy-agent

Due to all the possible permutations this will most likely end up being `.+_PROXY$`

**Comment by felddy** [comment]
The original use case for the proxy support was for the initialization of the container.  With this change the server itself will also use the proxy.  Hopefully this isn't a breaking change for anyone.  But it might be.  If it turns out to be a problem, I may have to separate proxy settings during initialization from proxy settings during execution.  🤞 

- #1284

@Taner314, do you foresee any problems arising from this change?
